title	date	link	author
Universal ZTNA is Fundamental to Your Zero Trust Strategy		https://www.securityweek.com//universal-ztna-fundamental-your-zero-trust-strategy	John Maddison
What to Expect in 2022: Microservices Will Bring Macro Threats		https://www.securityweek.com//what-expect-2022-microservices-will-bring-macro-threats	Laurence Pitt
Building a Secure Remote Connection Solution for Today's Business		https://www.securityweek.com//building-secure-remote-connection-solution-todays-business	John Maddison
The New Paradigm for Work from Anywhere: Zero Trust Network Access (ZTNA)		https://www.securityweek.com//new-paradigm-work-anywhere-zero-trust-network-access-ztna	Torsten George
The Impact of the Pandemic on Today's Approach to Cybersecurity		https://www.securityweek.com//impact-pandemic-todays-approach-cybersecurity	Torsten George
The VC View: Identity = Zero Trust for Everything		https://www.securityweek.com//vc-view-identity-zero-trust-everything	William Lin
Debunking the Top User Experience, Security, and Fraud Myths		https://www.securityweek.com//debunking-top-user-experience-security-and-fraud-myths	Joshua Goldfarb
In the Hacker's Crosshairs: Active Directory		https://www.securityweek.com//hackers-crosshairs-active-directory	Torsten George
Why Better Password Hygiene Should Be Part of Your New Year's Resolutions		https://www.securityweek.com//why-better-password-hygiene-should-be-part-your-new-years-resolutions	Torsten George
Three Critical Threats on the Horizon You Need to Prepare For		https://www.securityweek.com//three-critical-threats-horizon-you-need-prepare	Torsten George
"Takeaways From the ""CryptoForHealth"" Twitter Hack"		https://www.securityweek.com//takeaways-cryptoforhealth-twitter-hack	Torsten George
Two Musts for Managing a Remote Workforce: Identity Governance and Lifecycle		https://www.securityweek.com//two-musts-managing-remote-workforce-identity-governance-and-lifecycle	Jim Ducharme
Non-Human Identities: The New Blindspot in Cybersecurity		https://www.securityweek.com//non-human-identities-new-blindspot-cybersecurity	Torsten George
On the Rise: The Enemy From Within		https://www.securityweek.com//rise-enemy-within-protect-against-insider-threats	Torsten George
Cyber Resilience: Doing More with Less		https://www.securityweek.com//cyber-resilience-doing-more-less	Torsten George
The Human Element and Beyond: Why Static Passwords Aren't Enough		https://www.securityweek.com//human-element-and-beyond-why-static-passwords-arent-enough	Torsten George
Is Conditional Access the Right Approach to Authentication? It Depends.		https://www.securityweek.com//conditional-access-right-approach-authentication-it-depends	Jim Ducharme
Tips for a Smarter Approach to Password Policy		https://www.securityweek.com//tips-smarter-approach-password-policy	Josh Lefkowitz
The More Authentication Methods, the Merrier		https://www.securityweek.com//more-authentication-methods-merrier	Jim Ducharme
Half Protected is Half Empty, Not Half Full		https://www.securityweek.com//half-protected-half-empty-not-half-full	Torsten George
Making the Most of a Changing Workforce Environment		https://www.securityweek.com//making-most-changing-workforce-environment	Joshua Goldfarb
How Do We Get to a Passwordless World? One Step at a Time.		https://www.securityweek.com//how-do-we-get-passwordless-world-one-step-time	Jim Ducharme
Reality Check on the Demise of Multi-Factor Authentication		https://www.securityweek.com//reality-check-demise-multi-factor-authentication	Torsten George
How to Choose an Authenticator. Or Two. Or Three.		https://www.securityweek.com//how-choose-authenticator-or-two-or-three	Jim Ducharme
Ready or Not, Here Comes FIDO: How to Prepare for Success		https://www.securityweek.com//ready-or-not-here-comes-fido-how-prepare-success	Jim Ducharme
Biometrics: Dismantling the Myths Surrounding Facial Recognition		https://www.securityweek.com//biometrics-dismantling-myths-surrounding-facial-recognition	Jim Ducharme
Another World Password Day Has Passed and Little Has Changed		https://www.securityweek.com//another-world-password-day-has-passed-and-little-has-changed	Torsten George
Beyond Biometrics: The Future of Authentication		https://www.securityweek.com//beyond-biometrics-future-authentication	Jim Ducharme
6 Ways Attackers Are Still Bypassing SMS 2-Factor Authentication		https://www.securityweek.com//6-ways-attackers-are-still-bypassing-sms-2-factor-authentication	David Holmes
Cyber Security's New Center Point: Zero Trust		https://www.securityweek.com//cyber-securitys-new-center-point-zero-trust	Torsten George
The Anatomy of a Hack: Perception vs. Reality		https://www.securityweek.com//anatomy-hack-perception-vs-reality	Torsten George
Why Not Always Multi-Factor Authentication?		https://www.securityweek.com//why-not-always-multi-factor-authentication	Erin O’Malley
Why User Names and Passwords Are Not Enough		https://www.securityweek.com//why-user-names-and-passwords-are-not-enough	Torsten George
The (Re-)Emergence of Zero Trust		https://www.securityweek.com//re-emergence-zero-trust	Torsten George
A New Year's Resolution: Security is Broken…Let's Fix It		https://www.securityweek.com//new-years-resolution-security-broken%E2%80%A6lets-fix-it	Torsten George
How Security can Drive Business Competitiveness		https://www.securityweek.com//how-security-can-drive-business-competitiveness	Travis Greene
The Enduring Password Conundrum		https://www.securityweek.com//enduring-password-conundrum	Torsten George
The Real Takeaways From the Reddit Hack		https://www.securityweek.com//real-takeaways-reddit-hack	Torsten George
The Foundation of Cyber-Attacks: Credential Harvesting		https://www.securityweek.com//foundation-cyber-attacks-credential-harvesting	Torsten George
Don't Ignore Identity Governance for Privileged Users		https://www.securityweek.com//dont-ignore-identity-governance-privileged-users	Travis Greene
Insider Threat: Common Myths and Misconceptions		https://www.securityweek.com//insider-threat-common-myths-and-misconceptions	Josh Lefkowitz
Spring 2018 Password Attacks		https://www.securityweek.com//spring-2018-password-attacks	David Holmes
Closing the Gaps that Result in Compromised Credentials		https://www.securityweek.com//closing-gaps-result-compromised-credentials	Travis Greene
The Kiss of Death for Passwords: Machine Learning?		https://www.securityweek.com//kiss-death-passwords-machine-learning	Torsten George
Compromised Credentials: The Primary Point of Attack for Data Breaches		https://www.securityweek.com//compromised-credentials-primary-point-attack-data-breaches	Torsten George
The Goldilocks Effect of Cyber Threat Data		https://www.securityweek.com//goldilocks-effect-cyber-threat-data	Marc Solomon
Trouble in Paradise as Cyber Attackers Circumvent 2FA		https://www.securityweek.com//trouble-paradise-cyber-attackers-circumvent-2fa	Markus Jakobsson
Stop Blaming Users and Get Serious About Your IAM Practices		https://www.securityweek.com//stop-blaming-users-and-get-serious-about-your-iam-practices	Preston Hogue
Don't be Overtaken by Account Takeovers		https://www.securityweek.com//dont-be-overtaken-account-takeovers	Alastair Paterson
If Loose Lips Sink Ships, What do They do to Enterprise Security?		https://www.securityweek.com//if-loose-lips-sink-ships-what-do-they-do-enterprise-security	Travis Greene
Stressing Over Stolen and Abused User Credentials?		https://www.securityweek.com//stressing-over-stolen-and-abused-user-credentials	Scott Simkin
Evaluating Risks to Identity and Access When Moving to the Cloud		https://www.securityweek.com//evaluating-risks-identity-and-access-when-moving-cloud	David Holmes
Passwords are Dead. Long Live Passwords.		https://www.securityweek.com//passwords-are-dead-long-live-passwords	Rafal Los
Another Potential Victim of the Yahoo! Breach: Federated Login		https://www.securityweek.com//another-potential-victim-yahoo-breach-federated-login	David Holmes
Preventing Account Creation Fraud with Two-Factor Authentication		https://www.securityweek.com//preventing-account-creation-fraud-two-factor-authentication	Travis Greene
Identity Governance Isn't Just for Compliance Anymore		https://www.securityweek.com//identity-governance-isnt-just-compliance-anymore	Travis Greene
The Great Analyst Debate Over Consumer IAM		https://www.securityweek.com//great-analyst-debate-over-consumer-iam	Travis Greene
When Multi-Factor Authentication Fails		https://www.securityweek.com//when-multi-factor-authentication-fails	Travis Greene
Multi-factor Authentication: Waking up to the Elephant in the Room		https://www.securityweek.com//multi-factor-authentication-waking-elephant-room	Travis Greene
The Panama Papers Wake Up Call		https://www.securityweek.com//panama-papers-wake-call	Travis Greene
The Emergence of Identity as an Enterprise Attack Surface		https://www.securityweek.com//emergence-identity-enterprise-attack-surface	Rafal Los
Is Security Doomed to Always React to the Threat?		https://www.securityweek.com//security-doomed-always-react-threat	Travis Greene
From Understanding Social Media Risks to Preventing Them		https://www.securityweek.com//understanding-social-media-risks-preventing-them	Alastair Paterson
The Need for User Segmentation in the Data Center		https://www.securityweek.com//need-user-segmentation-data-center	Alan Cohen
Your Line of Business Hates Access Certifications - You Should Too!		https://www.securityweek.com//your-line-business-hates-access-certifications-you-should-too	Travis Greene
How to Tell Whether You're Getting a Return on Governance		https://www.securityweek.com//how-tell-whether-youre-getting-return-governance	Travis Greene
Is Yahoo's New Account Key the Future of Authentication?		https://www.securityweek.com//yahoos-new-account-key-future-authentication	Travis Greene
Is Identity the New Perimeter? What Would Donald Trump Think?		https://www.securityweek.com//identity-new-perimeter-what-would-donald-trump-think	Travis Greene
The Most Vicious Zero-Day Exploit? Insiders.		https://www.securityweek.com//most-vicious-zero-day-exploit-insiders	Travis Greene
The Second War of Independence: Wearables vs. Security		https://www.securityweek.com//second-war-independence-wearables-vs-security	Travis Greene
Spending on IT Security like Larry Ellison Spends on Racing		https://www.securityweek.com//spending-it-security-larry-ellison-spends-racing	Travis Greene
I Told You SSO		https://www.securityweek.com//i-told-you-sso	Travis Greene
Protecting the Protectors: Putting Network and Security Admins First		https://www.securityweek.com//protecting-protectors-putting-network-and-security-admins-first	Wade Williamson
IT Compliance Lessons from College Football Recruiting, Part 2		https://www.securityweek.com//it-compliance-lessons-college-football-recruiting-part-2	Travis Greene
IT Compliance Lessons from College Football Recruiting		https://www.securityweek.com//it-compliance-lessons-college-football-recruiting	Travis Greene
Complexity is Your New Best Friend		https://www.securityweek.com//complexity-your-new-best-friend	Travis Greene
Lessons Learned from Data Breaches and File-names		https://www.securityweek.com//lessons-learned-data-breaches-and-file-names	Scott Simkin
Insider Threat Denial: The Driverless Car of the Enterprise		https://www.securityweek.com//insider-threat-denial-driverless-car-enterprise	Travis Greene
Attack of the Access Clones - How Organizations Can Strike Back		https://www.securityweek.com//attack-access-clones-how-organizations-can-strike-back	Travis Greene
How Access Governance is Like Running a Movie Theater		https://www.securityweek.com//how-access-governance-running-movie-theater	Travis Greene
Brute-force Attacks: Crossing the Online-Offline Password Chasm		https://www.securityweek.com//brute-force-attacks-crossing-online-offline-password-chasm	Tal Be'ery
Big Data, Smaller Problems: Configuring Kerberos Authentication for Hadoop		https://www.securityweek.com//big-data-smaller-problems-configuring-kerberos-authentication-hadoop	Eddie Garcia
Passwords: To be or knOt2$B3? Take the Quiz!		https://www.securityweek.com//passwords-be-or-knot2b3-take-quiz	Jon-Louis Heimerl
Is Your Identity and Access Management Out of Control? (Part 2)		https://www.securityweek.com//your-identity-and-access-management-out-control-part-2	Travis Greene
Is Your Identity and Access Management Out of Control?		https://www.securityweek.com//your-identity-and-access-management-out-control	Travis Greene
Mobile Identity for the Enterprise: Pitfalls and Opportunities		https://www.securityweek.com//mobile-identity-enterprise-pitfalls-and-opportunities	Travis Greene
A False Sense of Security: Who is Using Your Accounts?		https://www.securityweek.com//false-sense-security-who-using-your-accounts	Travis Greene
Today's Biggest Security Gap? Identity.		https://www.securityweek.com//todays-biggest-security-gap-identity	Travis Greene
Security: The Ultimate Balancing Act		https://www.securityweek.com//security-ultimate-balancing-act	Travis Greene
Convenience and Security: The New Face of Two-Factor Authentication		https://www.securityweek.com//convenience-and-security-new-face-two-factor-authentication	Chris Hinkley
Exercising Alternatives to Detect and Prevent Brute Force Attacks		https://www.securityweek.com//exercising-alternatives-detect-and-prevent-brute-force-attacks	Michael Callahan
What Can Airport Security Teach us About Dealing with Insider Threats?		https://www.securityweek.com//what-can-airport-security-teach-us-about-dealing-insider-threats	Mike Tierney
Hackers Just Made Off with Two Million Passwords, Now What?		https://www.securityweek.com//hackers-just-made-two-million-passwords-now-what	Gil Zimmermann
Extending the DevOps Model to Achieve Operational Excellence and Improved Security		https://www.securityweek.com//extending-devops-model-achieve-operational-excellence-and-improved-security	Nimmy Reichenberg
When it Comes to Security, Big Data isn't Big Enough		https://www.securityweek.com//when-it-comes-security-big-data-isnt-big-enough	Nick Cavalancia
The Human Side of Security		https://www.securityweek.com//human-side-security	Mark Hatton
When it Comes to Your Infrastructure, Security is More than Skin Deep		https://www.securityweek.com//when-it-comes-your-infrastructure-security-more-skin-deep	Chris Hinkley
Beware of Googlers Bearing Gifts		https://www.securityweek.com//beware-googlers-bearing-gifts	Tal Be'ery
SecurityWeek Top 25 Picks for 2010		https://www.securityweek.com//securityweek-top-25-picks-2010	Mike Lennon
Up Next: 911 For the Web		https://www.securityweek.com//next-911-web	Tom Grubb
Three Steps to Safer Passwords		https://www.securityweek.com//three-steps-safer-passwords	Ram Mohan
WikiLeaks Shows the Need for Improved Separation and Isolation of Information		https://www.securityweek.com//wikileaks-shows-need-improved-separation-and-isolation-information	Jimmy Sorrells
Unspoofable Device Identity Using NAND Flash Memory		https://www.securityweek.com//unspoofable-device-identity-using-nand-flash-memory	Markus Jakobsson
Universal ZTNA is Fundamental to Your Zero Trust Strategy		https://www.securityweek.com//universal-ztna-fundamental-your-zero-trust-strategy	John Maddison
What to Expect in 2022: Microservices Will Bring Macro Threats		https://www.securityweek.com//what-expect-2022-microservices-will-bring-macro-threats	Laurence Pitt
Building a Secure Remote Connection Solution for Today's Business		https://www.securityweek.com//building-secure-remote-connection-solution-todays-business	John Maddison
The New Paradigm for Work from Anywhere: Zero Trust Network Access (ZTNA)		https://www.securityweek.com//new-paradigm-work-anywhere-zero-trust-network-access-ztna	Torsten George
The Impact of the Pandemic on Today's Approach to Cybersecurity		https://www.securityweek.com//impact-pandemic-todays-approach-cybersecurity	Torsten George
The VC View: Identity = Zero Trust for Everything		https://www.securityweek.com//vc-view-identity-zero-trust-everything	William Lin
Debunking the Top User Experience, Security, and Fraud Myths		https://www.securityweek.com//debunking-top-user-experience-security-and-fraud-myths	Joshua Goldfarb
In the Hacker's Crosshairs: Active Directory		https://www.securityweek.com//hackers-crosshairs-active-directory	Torsten George
Why Better Password Hygiene Should Be Part of Your New Year's Resolutions		https://www.securityweek.com//why-better-password-hygiene-should-be-part-your-new-years-resolutions	Torsten George
Three Critical Threats on the Horizon You Need to Prepare For		https://www.securityweek.com//three-critical-threats-horizon-you-need-prepare	Torsten George
Universal ZTNA is Fundamental to Your Zero Trust Strategy		https://www.securityweek.com//universal-ztna-fundamental-your-zero-trust-strategy	John Maddison
What to Expect in 2022: Microservices Will Bring Macro Threats		https://www.securityweek.com//what-expect-2022-microservices-will-bring-macro-threats	Laurence Pitt
Building a Secure Remote Connection Solution for Today's Business		https://www.securityweek.com//building-secure-remote-connection-solution-todays-business	John Maddison
The New Paradigm for Work from Anywhere: Zero Trust Network Access (ZTNA)		https://www.securityweek.com//new-paradigm-work-anywhere-zero-trust-network-access-ztna	Torsten George
The Impact of the Pandemic on Today's Approach to Cybersecurity		https://www.securityweek.com//impact-pandemic-todays-approach-cybersecurity	Torsten George
The VC View: Identity = Zero Trust for Everything		https://www.securityweek.com//vc-view-identity-zero-trust-everything	William Lin
Debunking the Top User Experience, Security, and Fraud Myths		https://www.securityweek.com//debunking-top-user-experience-security-and-fraud-myths	Joshua Goldfarb
In the Hacker's Crosshairs: Active Directory		https://www.securityweek.com//hackers-crosshairs-active-directory	Torsten George
Why Better Password Hygiene Should Be Part of Your New Year's Resolutions		https://www.securityweek.com//why-better-password-hygiene-should-be-part-your-new-years-resolutions	Torsten George
Three Critical Threats on the Horizon You Need to Prepare For		https://www.securityweek.com//three-critical-threats-horizon-you-need-prepare	Torsten George
Universal ZTNA is Fundamental to Your Zero Trust Strategy		https://www.securityweek.com//universal-ztna-fundamental-your-zero-trust-strategy	John Maddison
What to Expect in 2022: Microservices Will Bring Macro Threats		https://www.securityweek.com//what-expect-2022-microservices-will-bring-macro-threats	Laurence Pitt
Building a Secure Remote Connection Solution for Today's Business		https://www.securityweek.com//building-secure-remote-connection-solution-todays-business	John Maddison
The New Paradigm for Work from Anywhere: Zero Trust Network Access (ZTNA)		https://www.securityweek.com//new-paradigm-work-anywhere-zero-trust-network-access-ztna	Torsten George
The Impact of the Pandemic on Today's Approach to Cybersecurity		https://www.securityweek.com//impact-pandemic-todays-approach-cybersecurity	Torsten George
The VC View: Identity = Zero Trust for Everything		https://www.securityweek.com//vc-view-identity-zero-trust-everything	William Lin
Debunking the Top User Experience, Security, and Fraud Myths		https://www.securityweek.com//debunking-top-user-experience-security-and-fraud-myths	Joshua Goldfarb
In the Hacker's Crosshairs: Active Directory		https://www.securityweek.com//hackers-crosshairs-active-directory	Torsten George
Why Better Password Hygiene Should Be Part of Your New Year's Resolutions		https://www.securityweek.com//why-better-password-hygiene-should-be-part-your-new-years-resolutions	Torsten George
Three Critical Threats on the Horizon You Need to Prepare For		https://www.securityweek.com//three-critical-threats-horizon-you-need-prepare	Torsten George
"Takeaways From the ""CryptoForHealth"" Twitter Hack"		https://www.securityweek.com//takeaways-cryptoforhealth-twitter-hack	Torsten George
Two Musts for Managing a Remote Workforce: Identity Governance and Lifecycle		https://www.securityweek.com//two-musts-managing-remote-workforce-identity-governance-and-lifecycle	Jim Ducharme
Non-Human Identities: The New Blindspot in Cybersecurity		https://www.securityweek.com//non-human-identities-new-blindspot-cybersecurity	Torsten George
On the Rise: The Enemy From Within		https://www.securityweek.com//rise-enemy-within-protect-against-insider-threats	Torsten George
Cyber Resilience: Doing More with Less		https://www.securityweek.com//cyber-resilience-doing-more-less	Torsten George
The Human Element and Beyond: Why Static Passwords Aren't Enough		https://www.securityweek.com//human-element-and-beyond-why-static-passwords-arent-enough	Torsten George
Is Conditional Access the Right Approach to Authentication? It Depends.		https://www.securityweek.com//conditional-access-right-approach-authentication-it-depends	Jim Ducharme
Tips for a Smarter Approach to Password Policy		https://www.securityweek.com//tips-smarter-approach-password-policy	Josh Lefkowitz
The More Authentication Methods, the Merrier		https://www.securityweek.com//more-authentication-methods-merrier	Jim Ducharme
Half Protected is Half Empty, Not Half Full		https://www.securityweek.com//half-protected-half-empty-not-half-full	Torsten George
Making the Most of a Changing Workforce Environment		https://www.securityweek.com//making-most-changing-workforce-environment	Joshua Goldfarb
How Do We Get to a Passwordless World? One Step at a Time.		https://www.securityweek.com//how-do-we-get-passwordless-world-one-step-time	Jim Ducharme
Reality Check on the Demise of Multi-Factor Authentication		https://www.securityweek.com//reality-check-demise-multi-factor-authentication	Torsten George
How to Choose an Authenticator. Or Two. Or Three.		https://www.securityweek.com//how-choose-authenticator-or-two-or-three	Jim Ducharme
Ready or Not, Here Comes FIDO: How to Prepare for Success		https://www.securityweek.com//ready-or-not-here-comes-fido-how-prepare-success	Jim Ducharme
Biometrics: Dismantling the Myths Surrounding Facial Recognition		https://www.securityweek.com//biometrics-dismantling-myths-surrounding-facial-recognition	Jim Ducharme
Another World Password Day Has Passed and Little Has Changed		https://www.securityweek.com//another-world-password-day-has-passed-and-little-has-changed	Torsten George
Beyond Biometrics: The Future of Authentication		https://www.securityweek.com//beyond-biometrics-future-authentication	Jim Ducharme
6 Ways Attackers Are Still Bypassing SMS 2-Factor Authentication		https://www.securityweek.com//6-ways-attackers-are-still-bypassing-sms-2-factor-authentication	David Holmes
Cyber Security's New Center Point: Zero Trust		https://www.securityweek.com//cyber-securitys-new-center-point-zero-trust	Torsten George
The Anatomy of a Hack: Perception vs. Reality		https://www.securityweek.com//anatomy-hack-perception-vs-reality	Torsten George
Why Not Always Multi-Factor Authentication?		https://www.securityweek.com//why-not-always-multi-factor-authentication	Erin O’Malley
Why User Names and Passwords Are Not Enough		https://www.securityweek.com//why-user-names-and-passwords-are-not-enough	Torsten George
The (Re-)Emergence of Zero Trust		https://www.securityweek.com//re-emergence-zero-trust	Torsten George
A New Year's Resolution: Security is Broken…Let's Fix It		https://www.securityweek.com//new-years-resolution-security-broken%E2%80%A6lets-fix-it	Torsten George
How Security can Drive Business Competitiveness		https://www.securityweek.com//how-security-can-drive-business-competitiveness	Travis Greene
The Enduring Password Conundrum		https://www.securityweek.com//enduring-password-conundrum	Torsten George
The Real Takeaways From the Reddit Hack		https://www.securityweek.com//real-takeaways-reddit-hack	Torsten George
The Foundation of Cyber-Attacks: Credential Harvesting		https://www.securityweek.com//foundation-cyber-attacks-credential-harvesting	Torsten George
Don't Ignore Identity Governance for Privileged Users		https://www.securityweek.com//dont-ignore-identity-governance-privileged-users	Travis Greene
Insider Threat: Common Myths and Misconceptions		https://www.securityweek.com//insider-threat-common-myths-and-misconceptions	Josh Lefkowitz
Spring 2018 Password Attacks		https://www.securityweek.com//spring-2018-password-attacks	David Holmes
Closing the Gaps that Result in Compromised Credentials		https://www.securityweek.com//closing-gaps-result-compromised-credentials	Travis Greene
The Kiss of Death for Passwords: Machine Learning?		https://www.securityweek.com//kiss-death-passwords-machine-learning	Torsten George
Compromised Credentials: The Primary Point of Attack for Data Breaches		https://www.securityweek.com//compromised-credentials-primary-point-attack-data-breaches	Torsten George
The Goldilocks Effect of Cyber Threat Data		https://www.securityweek.com//goldilocks-effect-cyber-threat-data	Marc Solomon
Trouble in Paradise as Cyber Attackers Circumvent 2FA		https://www.securityweek.com//trouble-paradise-cyber-attackers-circumvent-2fa	Markus Jakobsson
Stop Blaming Users and Get Serious About Your IAM Practices		https://www.securityweek.com//stop-blaming-users-and-get-serious-about-your-iam-practices	Preston Hogue
Don't be Overtaken by Account Takeovers		https://www.securityweek.com//dont-be-overtaken-account-takeovers	Alastair Paterson
If Loose Lips Sink Ships, What do They do to Enterprise Security?		https://www.securityweek.com//if-loose-lips-sink-ships-what-do-they-do-enterprise-security	Travis Greene
Stressing Over Stolen and Abused User Credentials?		https://www.securityweek.com//stressing-over-stolen-and-abused-user-credentials	Scott Simkin
Evaluating Risks to Identity and Access When Moving to the Cloud		https://www.securityweek.com//evaluating-risks-identity-and-access-when-moving-cloud	David Holmes
Passwords are Dead. Long Live Passwords.		https://www.securityweek.com//passwords-are-dead-long-live-passwords	Rafal Los
